<?xml version="1.0" encoding="utf-8"?>
<VoodooManifest type="remote" xmlns:xsi="http://www.w3.org/2001/XMLSchema-instance" xsi:noNamespaceSchemaLocation="http://www.voodooshader.com/manifests/RemoteManifest.xsd">
    <Packages>
        <Package>
            <Name>Package 1 Name</Name>
            <PackID>01234567-0123-0123-0123-0123456789AB</PackID>
            <Version>Version String</Version>
            <Date>2011-01-11</Date>
            <ManifestUri>http://test/manifests/Package1.xml</ManifestUri>        
        </Package>
        <Package>
            <Name>Package 2 Name</Name>
            <PackID>01234567-0123-0123-0123-0123456789AC</PackID>
            <Version>Version String</Version>
            <Date>2011-01-13</Date>
            <ManifestUri>http://test/manifests/Package2.xml</ManifestUri>
        </Package>
    </Packages>
    <Modules>
        <Module>
            <Name>Module 1</Name>
            <LibID>01234567-0123-0123-0123-0123456789AD</LibID>
            <PackID>01234567-0123-0123-0123-0123456789AC</PackID>
        </Module>
        <Module>
            <Name>Module 2</Name>
            <LibID>01234567-0123-0123-0123-0123456789AE</LibID>
            <PackID>01234567-0123-0123-0123-0123456789AB</PackID>
        </Module>
    </Modules>
    <Classes>
        <Class>
            <Name>Class 1</Name>
            <ClsID>01234567-0123-0123-0123-0123456789BE</ClsID>
            <LibID>01234567-0123-0123-0123-0123456789AD</LibID>
        </Class>
        <Class>
            <Name>Class 2</Name>
            <ClsID>01234567-0123-0123-0123-0123456789BB</ClsID>
            <LibID>01234567-0123-0123-0123-0123456789AE</LibID>          
        </Class>
    </Classes>
</VoodooManifest>